{
  "schema": "qlkg-ingest-receipt-v1",
  "request_id": "synthetic-v1-request",
  "request_sha256": "1111111111111111111111111111111111111111111111111111111111111111",
  "receipt_sha256": "2222222222222222222222222222222222222222222222222222222222222222",
  "engine": {"name": "kgdistiller", "version": "0.3.0"},
  "before": {"graph_sha256": "3333333333333333333333333333333333333333333333333333333333333333", "alignment_sha256": "4444444444444444444444444444444444444444444444444444444444444444", "source_hashes": {}},
  "after": {"graph_sha256": "3333333333333333333333333333333333333333333333333333333333333333", "alignment_sha256": "4444444444444444444444444444444444444444444444444444444444444444", "source_hashes": {}},
  "changes": {},
  "validations": [],
  "durations_ms": {},
  "warnings": [],
  "status": "committed"
}
